,date,id,published_on,title,body,url,imageurl,tags,categories
117,2022-01-12,27420993,1642027868,Top 7 Metaverse Crypto Coins Below $7 Million Market Cap to Watch in 2022,"Metaverse Crypto Coins are doing quite well today, with many seeing bullish momentum. There are dozens of underrated Metaverse projects that have yet to blow up. That&#8217;s why we hand-picked our top seven favorite Metaverse crypto coins with a market cap below $7 million, ordered by overall valuation, lowest to highest. ShoeFy (SHOE) &#8211; $600k [&#8230;]The post Top 7 Metaverse Crypto Coins Below $7 Million Market Cap to Watch in 2022 appeared first on NullTX.",https://nulltx.com/top-7-metaverse-crypto-coins-below-7-million-market-cap-to-watch-in-2022/,https://images.cryptocompare.com/news/default/nulltx.png,Featured|metaverse,Market|Trading|Sponsored
118,2022-01-11,27420342,1641941400,$BABYDOGE Community Rallies for Binance Listing After 99% Rise YTD,"Supporters of the meme-inspired cryptocurrency BabyDoge ($BABYDOGE) have been rallying to get the token listed on leading cryptocurrency exchange Binance through a campaign the trading platform launched where it asked users to make wishes in a bid to make some of them come true. In response to the campaign, the BABYDOGE community quickly started asking […]",https://www.cryptoglobe.com/latest/2022/01/babydoge-community-rallies-for-binance-listing-after-99-rise-ytd/,https://images.cryptocompare.com/news/cryptoglobe/c5i9G44Perp.jpeg,Altcoins,Exchange|ICO|Trading|Altcoin
119,2022-01-11,27420340,1641941311,Crypto Prices Are Down While the NFT Market Remains Red Hot. Here’s Why,"Despite cooling crypto prices so far in 2022, NFTs are soaring to potential new heights. What’s causing the divergence?",https://decrypt.co/90228/crypto-prices-down-nft-market-red-hot-ethereum-solana,https://images.cryptocompare.com/news/default/decrypt.png,NFTs|ETH,Market|ETH
120,2022-01-10,27419844,1641855268,The Crypto Company uplists to OTCQB Venture Marketplace,"The Crypto Company (OTCPK:CRCW) uplists from the OTC Pink Sheets to the OTCQB Venture Marketplace. The firm started trading on the OTCQB Venture as of Jan. 10, under the symbol ""CRCW"".",https://seekingalpha.com/news/3786900-the-crypto-company-uplists-to-otcqb-venture-marketplace?utm_source=cryptocompare.com&utm_medium=referral,https://images.cryptocompare.com/news/default/seekingalpha.png,,Trading
121,2022-01-10,27419829,1641854893,Top 5 Underrated Metaverse Crypto Coins With a Market Cap Below $3 Million,"There are hundreds of Metaverse crypto coins on the market right now, and with the number of choices available, it might be hard to figure out which projects are the real deal. This is why we handpicked five underrated Metaverse crypto coins with a market cap below $5 million, ordered by overall valuation, lowest to [&#8230;]The post Top 5 Underrated Metaverse Crypto Coins With a Market Cap Below $3 Million appeared first on NullTX.",https://nulltx.com/top-5-underrated-metaverse-crypto-coins-with-a-market-cap-below-3-million/,https://images.cryptocompare.com/news/default/nulltx.png,Featured|metaverse,Market|Sponsored
122,2022-01-09,27419285,1641767442,Here’s why a full recovery for AAVE could take time despite bullish divergence,"The new year has been relatively better for altcoins which have been doing well against the broader market sentiment. AAVE in particular has seen accelerated growth. The Defi money market platform has come up with a more concrete plan for 2022 focused on usability, aiming to push on-chain activity. AAVE, after revealing plans to launch [&#8230;]",https://ambcrypto.com/heres-why-a-full-recovery-for-aave-could-take-time-despite-bullish-divergence/,https://images.cryptocompare.com/news/default/ambcrypto.png,Altcoins|News|News 1|Social|Trading View|AAVE|Aave Arc,Market|Altcoin|Trading
123,2022-01-09,27419283,1641767426,Mai Capital Predicts Tough Year for Crypto — Expects Bitcoin and Ethereum to Do Well Once Regulations Come Into Focus,"Mai Capital Management&#x2019;s chief equity strategist and regional president, Chris Grisanti, has predicted that this year will be tough for crypto largely due to regulations. However, he expects established cryptocurrencies, such as bitcoin and ether, to &#x201C;do quite well&#x201D; once regulations come into focus. Equity Strategist&#x2019;s Crypto Predictions Mai Capital Management&#x2019;s Chris Grisanti shared his [&#8230;]",https://news.bitcoin.com/mai-capital-predicts-tough-year-for-crypto-bitcoin-ethereum-do-well-once-regulations-come-into-focus/,https://images.cryptocompare.com/news/default/bitcoincom.png,Regulation|bitcoin prediction|crypto prediction|Crypto regulation|cryptocurrency prediction|Cryptocurrency regulation|equity strategist|ether prediction|ethereum prediction|Mai Capital|Mai Capital Management,BTC|Regulation|ETH
124,2022-01-08,27419056,1641682440,"Are MATIC, EGLD, LUNA, And DOT The Altcoins To Hodl For A 3X Surge By Q2 Of 2022?","The post Are MATIC, EGLD, LUNA, And DOT The Altcoins To Hodl For A 3X Surge By Q2 Of 2022? appeared first on Coinpedia - Fintech &amp; Cryptocurreny News Media| Crypto GuideThe cryptoverse’s corrections have paved the way for newer opportunities for older hands. To bag potential coins, which are now up for grabs at slashed rates. In an ocean of&#160; opportunities, which now has emerging projects such as NFTs, Metaverse, and DeFi. Mainstream cryptocurrencies remain the primary priority of savvies. The hunt for capable digital &#8230;",https://coinpedia.org/altcoin/are-matic-egld-luna-and-dot-the-altcoins-to-hodl-for-a-3x-surge-by-q2-of-2022/,https://images.cryptocompare.com/news/default/coinpedia.png,Altcoins|Crypto news|cryptocurrency|DeFi|Price Analysis,Altcoin
125,2022-01-08,27419054,1641681300,5 NFT-based blockchain games that could soar in 2022,"NFTs look ready to rule 2022, and the recent pivot toward NFT utility in P2E gaming could make blockchain gaming this year’s sector darling.",https://cointelegraph.com/news/5-nft-based-blockchain-games-that-could-soar-in-2022,https://images.cryptocompare.com/news/default/cointelegraph.png,Cryptocurrencies|Markets|Market Analysis|Blockchain Game|Gaming,Blockchain|Market
126,2022-01-07,27418789,1641596196,"Andreessen Horowitz Calls For 'Targeted' Regulations for DeFi, Stablecoins and Web3","Following the lead of Coinbase and others, Andreessen Horowitz proposed its own regulatory recommendations for cryptocurrency.",https://decrypt.co/89998/andreessen-horowitz-targeted-regulations-defi-stablecoins-web3,https://images.cryptocompare.com/news/default/decrypt.png,Technology|BTC|ETH|USDT,BTC|ETH|USDT|Technology
127,2022-01-07,27418787,1641595642,Pantera’s Bitcoin Feeder Fund reaches $63.7 million in funding,"Through the Bitcoin Feeder Fund, investors can partake in its Bitcoin Fund, a passive bitcoin tracker that gives investors daily equity. The post Pantera’s Bitcoin Feeder Fund reaches $63.7 million in funding appeared first on The Block.",https://www.theblockcrypto.com/linked/129630/panteras-bitcoin-feeder-fund-reaches-63-7-million-in-funding?utm_source=cryptocompare&utm_medium=rss,https://images.cryptocompare.com/news/default/theblock.png,Investments|bitcoin|Bitcoin Feeder Fund|Bitcoin fund|Funding|Pantera Capital,BTC|Business
128,2022-01-06,27417914,1641509695,Coinbase: Crypto Is Here To Stay,"On April 14, 2021, the cryptocurrency exchange platform Coinbase went public on the Nasdaq with a price of $328.28 per share, giving it a whopping valuation of ​​$85.7 billion.Although the crypto market has seen high uncertainty in the past year, Coinbase stands out as an undervalued stock pick due to strong financials and product growth opportunities.It is clear that crypto is here to stay and Coinbase will benefit tremendously from the rising popularity and acceptance.We rate Coinbase Global, Inc. as a buy with a price target of $399.56, which is a 59.7% upside from the current price of $250.15.",https://seekingalpha.com/article/4478325-coinbase-crypto-is-here-to-stay?utm_source=cryptocompare.com&utm_medium=referral,https://images.cryptocompare.com/news/default/seekingalpha.png,,Trading|Exchange|Market|Business
129,2022-01-06,27417913,1641509439,"GameStop Hires 20-Person Team for Gaming NFT Marketplace, Stock Surges",GameStop stock rose 31% in after-hours trading.,https://decrypt.co/89912/gamestop-hires-20-person-team-gaming-nft-marketplace-stock-surges,https://images.cryptocompare.com/news/default/decrypt.png,Gaming|ETH,Business|ETH|Trading
130,2022-01-05,27417165,1641423496,"Bitcoin, Ethereum and Stock Prices Fall as Fed Readies Interest Rate Hike",The crypto market cap fell by more than 6% and stocks faltered after the Federal Reserve indicated that interest rates may soon rise.,https://decrypt.co/89833/bitcoin-ethereum-stock-prices-fall-fed-readies-interest-rate-hike,https://images.cryptocompare.com/news/default/decrypt.png,Markets|BTC|ETH,Market|BTC|ETH|Fiat|Business
131,2022-01-05,27417114,1641423000,Shiba Inu: 9 Businesses Pledge to Burn $SHIB Using Part of Their Profits,"A total of nine businesses have committed to using part of their profits to burn tokens of the meme-inspired cryptocurrency Shiba Inu ($SHIB) in a bid to reduce its circulating supply. The burns will be conducted by moving funds into the official SHIB burn wallet. As CryptoGlobe reported, in early December only 59% of Shiba […]",https://www.cryptoglobe.com/latest/2022/01/shiba-inu-9-businesses-pledge-to-burn-shib-using-part-of-their-profits/,https://images.cryptocompare.com/news/cryptoglobe/a3KgAg8023g.jpeg,Altcoins|Shiba Inu,ICO|Altcoin
132,2022-01-04,27416442,1641337139,Why DeFi platform WonderFi is acquiring crypto exchange Bitbuy,"Kevin O’Leary explains why WonderFi, a DeFi project he backs, is acquiring Canadian crypto exchange Bitbuy for $162 million.The post Why DeFi platform WonderFi is acquiring crypto exchange Bitbuy appeared first on The Block.",https://www.theblockcrypto.com/post/129232/why-defi-platform-wonderfi-is-acquiring-crypto-exchange-bitbuy?utm_source=cryptocompare&utm_medium=rss,https://images.cryptocompare.com/news/default/theblock.png,Cryptocurrency|DeFi|Bitbuy|Kevin O'Leary|WonderFi,Exchange
133,2022-01-04,27416439,1641336600,"Bitcoin Bull Max Keiser Changes $220,000 Price Prediction to This Year Based on Hashrate ATH","Popular cryptocurrency strategist and former Wall Street trader Max Keiser has reaffirmed he believes the price of bitcoin will hit $220,000, but changed his prediction to this year as his previous prediction, for 2021, ultimately failed to materialize. According to a tweet Keiser published, he believes that the computing power behind the network, the hashrate, […]",https://www.cryptoglobe.com/latest/2022/01/bitcoin-bull-max-keiser-changes-220000-price-prediction-to-this-year-based-on-hashrate-ath/,https://images.cryptocompare.com/news/cryptoglobe/aO8uAW0CYw1.jpeg,Bitcoin,BTC|Trading|Mining
134,2022-01-03,27415926,1641250746,"Grayscale reshuffles its DeFi index, adds Flexa’s AMP","Grayscale is shaking up its DeFi index. The post Grayscale reshuffles its DeFi index, adds Flexa&#8217;s AMP appeared first on The Block.",https://www.theblockcrypto.com/linked/129055/grayscale-reshuffles-its-defi-index-adds-flexas-amp?utm_source=cryptocompare&utm_medium=rss,https://images.cryptocompare.com/news/default/theblock.png,DeFi|grayscale|Impact,Market
135,2022-01-03,27415921,1641250146,Cosmos and Osmosis Surge While Rest of Market Flounders,,https://cryptobriefing.com/cosmos-and-osmosis-surge-while-rest-of-market-flounders/?utm_source=main_feed&utm_medium=rss,https://images.cryptocompare.com/news/default/cryptobriefing.png,Markets|Cosmos|DEX|Osmosis,Market
136,2022-01-02,27415378,1641163574,Crypto Corner: The Sports Slice,"Our team at Bitcoinist hopes you&#8217;ve had a great start to your 2022. Sports and crypto continue to collide, and we look forward to continuing to provide you with a weekly &#8216;slice&#8217; of the action every Sunday with The Sports Slice. Despite the holiday week leading to slower-than-usual headlines, there&#8217;s always some great action to [&#8230;]",https://bitcoinist.com/crypto-corner-the-sports-slice-20/,https://images.cryptocompare.com/news/default/bitcoinist.png,Altcoins|Bitcoin,BTC|Altcoin
137,2022-01-02,27415376,1641162615,Bitcoin: Can the first green candle of 2022 reverse recent losses,"Bitcoin’s entry in the new year is a much-anticipated event and has often left the market surprised. This time, however, the top asset made no major moves. The short-term bearish trajectory persisted and the hopes of a blasting entry in 2022 were met with disappointment. With Bitcoin still at the $47,188 mark, making the first [&#8230;]",https://ambcrypto.com/bitcoin-can-the-first-green-candle-of-2022-reverse-recent-losses/,https://images.cryptocompare.com/news/default/ambcrypto.png,Bitcoin|BTC Trading View|News|News 1|Social|Trading View|bitcoin ath|Bitcoin rally,BTC|Market|Trading
138,2022-01-01,27415182,1641076247,Here’s what this investment analyst predicts for Bitcoin in 2022,"Bitcoin frequently defied expectations in 2021 with both dizzying highs and lows. Naturally, investors might feel like they&#8217;re starting 2022 without a thread to lead them through the maze of what is to come. To that end, investment analyst Anthony Pompliano shared his crypto outlook for 2022, and explained why the new year is changing [&#8230;]",https://ambcrypto.com/heres-what-this-investment-analyst-predicts-for-bitcoin-in-2022/,https://images.cryptocompare.com/news/default/ambcrypto.png,Altcoins|Bitcoin|BTC Trading View|Global News|News|News 1|Social|Trading View|Anthony Pompliano|BTC,BTC|Altcoin|Business
139,2022-01-01,27415179,1641075502,NFTs In A Nutshell: A Weekly Review,"There was a lot of chatter around NFTs from big-time investors this week. However, some think that regulation is on the horizon as we jump into 2022. Meanwhile, a massive NFT art collector has over $2M worth of NFTs stolen, and a heated debate ensued. Sure, it&#8217;s a holiday week, but we&#8217;re still cracking open [&#8230;]",https://bitcoinist.com/nfts-in-a-nutshell-a-weekly-review-36/,https://images.cryptocompare.com/news/default/bitcoinist.png,NFT,Regulation|Business
