,date,id,published_on,title,body,url,imageurl,tags,categories
79,2022-01-31,27431384,1643669162,"JP Morgan: Bitcoin, Ethereum Continue to Face 'Significant Challenges'","Bitcoin is still 5x more volatile than gold, and Ethereum will continue to face competition from rival blockchains, analysts at the investment bank said.",https://decrypt.co/91612/jp-morgan-bitcoin-ethereum-challenges,https://images.cryptocompare.com/news/default/decrypt.png,Business|BTC|ETH,BTC|ETH|Fiat|Business
80,2022-01-30,27430939,1643582225,Crypto Winter: An Investor’s Big Fear…,"It&#8217;s been a challenging few months for crypto investors since Bitcoin fell from its all time high of 69k; on top of that, many coins have followed in BTC&#8217;s price action footsteps. The entire crypto market has shed more than $1 trillion in value since, and many experts believe more is to come and that this will not be the last of the wave; many people scramble to get a grasp onfwhat&#8217;s to come and if we will fall into another dreaded crypto winter. Related Reading &#124; Downward DOGE: Descending Dogecoin Pattern Predicts Deadly Drop Cold World For Crypto&#8230; The entire crypto market has lost roughly $1 trillion in value since November, around the time of bitcoin’s all-time high, and other tokens such as ether and solana followed the number one digital currency to trade sharply lower. Ethereum has more than halved in value since reaching its peak in November, while Solana has suffered an even steeper decline, falling 65 percent. Back in 2018, bitcoin went through what many now refer to as &#8216;crypto winter,&#8217; which saw witness to an 80 percent drop in bitcoin; could this be another case of the current price action BTC: Bitcoin fighting to break 40k after hitting all time high in November 2021. &#124; BTC:USDtradingview.com David Marcus, the former head of crypto at Facebook (now Meta), appeared to suggest that he believes a crypto winter has already arrived. In a tweet earlier this week, he said: “It...",https://www.newsbtc.com/news/bitcoin/crypto-winter-an-investors-big-fear/,https://images.cryptocompare.com/news/default/newsbtc.png,Bitcoin|Crypto|bitcoin|crypto winter|stablecoin,BTC|Market|Trading|ETH|ICO
81,2022-01-30,27430940,1643582121,"$ADA: Cardano-Powered DEX ADAX Goes Live, Plans to Integrate COTI’s Djed Stablecoin","On Sunday (January 30), the team behind ADAX, “an automated liquidity protocol that facilitates trades within the Cardano ecosystem in a completely decentralized and non-custodial way”, announced that their DEX had gone live on the mainnet. On 17 November 2021, an “Ask Me Anything (AMA) event was held on the official ADAX reddit account, where […]",https://www.cryptoglobe.com/latest/2022/01/cardano-powered-dex-adax-goes-live-plans-to-integrate-cotis-djed-stablecoin/,https://images.cryptocompare.com/news/cryptoglobe/9yooC8zcV18.jpeg,Cardano|DEXes,ADA|Blockchain
82,2022-01-29,27430755,1643495408,"After breaking down below recent lows, here’s where ICP is likely to head next","Ranked 32nd by market capitalization, Internet Computer saw its token ICP trading at $20.7 at the time of writing. It appeared to break the market structure in early January, but the intense selling pressure since then has actually seen ICP register a new set of lows at $19.1, just beneath the $20.9 lows in late [&#8230;]",https://ambcrypto.com/after-breaking-down-below-recent-lows-heres-where-icp-is-likely-to-head-next/,https://images.cryptocompare.com/news/default/ambcrypto.png,Altcoins|Analysis|HideCryptopanic|News|News 1|Social|Trading View|ICP price prediction|Internet Computer,Market|ICO|Trading|Altcoin
83,2022-01-29,27430754,1643493633,Do People Like Eric Adams Regret Getting Into Crypto?,"A lot of celebrities and politicians that have gotten into the crypto craze as of late are likely regretting their actions given that bitcoin and several other leading digital assets have experienced heavy price drops. Individuals like Eric Adams, the mayor of New York City; Aaron Rodgers, a quarterback with the Green Bay Packers, and...The post Do People Like Eric Adams Regret Getting Into Crypto? appeared first on Live Bitcoin News.",https://www.livebitcoinnews.com/do-people-like-eric-adams-regret-getting-into-crypto/,https://images.cryptocompare.com/news/default/livebitcoinnews.png,Bitcoin News|News|bitcoin|Eric Adams|Melania Trump,BTC|Trading
84,2022-01-28,27430535,1643409035,"Axie Infinity drops below $50, is this a bargain buy or is there more pain in store","A week ago the price of Axie Infinity stood at $75. However, even though there was a confluence of support levels right beneath $75 on lower timeframes at that time, the price crashed right through. This was not an isolated incident. The price of AXS has been steadily dropping, at times it has even dropped [&#8230;]",https://ambcrypto.com/axie-infinity-drops-below-50-is-this-a-bargain-buy-or-is-there-more-pain-in-store/,https://images.cryptocompare.com/news/default/ambcrypto.png,Altcoins|Analysis|HideCryptopanic|News|News 1|Social|Trading View|Axie Infinity|AXS,Trading|Market|Altcoin
85,2022-01-28,27430532,1643409030,Barstool Sports Blog Founder Dave Portnoy Spends a ‘Cool Million’ on 29 Bitcoin,"The founder of Barstool Sports blog, Dave Portnoy, announced he purchased 29 bitcoin on January 28, spending more than a million dollars. The day trader has had his ups and downs with bitcoin over the last few years, and it seems he&#x2019;s now jumping back into the market. Day Trader Dave Portnoy Bought 29 Bitcoin [&#8230;]",https://news.bitcoin.com/barstool-sports-blog-founder-dave-portnoy-spends-a-cool-million-on-29-bitcoin/,https://images.cryptocompare.com/news/default/bitcoincom.png,News|29 BTC|Barstool Sports blog|Barstool Sports blog founder|Barstool Sports blog President|Bitcoin|Bitcoin (BTC)|Buy Bitcoin|buy btc|cool million|dave portnoy|dave portnoy bitcoin|Day Trader|michael saylor|microstrategy ceo|million|Million Bucks|Parabolic Dave,BTC|Market
86,2022-01-27,27429845,1643324370,A look back at social media growth of crypto trends,"Quick TakeThe Block Research reviews social media metrics for the three biggest hype cycles of 2021We researched Twitter, Reddit, and Wikipedia to assess the degree of engagement around major Layer-1 blockchains, NFTs, and meme coins",https://www.theblockresearch.com/a-look-back-at-social-media-growth-of-crypto-trends-131869?utm_source=cryptocompare&utm_medium=rss,https://images.cryptocompare.com/news/default/theblock.png,Blockchain|Markets|NFT|Projects|$DOGE|$SHIB|elon musk|reddit|social|twitter|wikipedia,Market|Blockchain
87,2022-01-27,27429840,1643323800,$XLM Smart Contracts Are Coming to Stellar Network,"Smart contracts are set to be launched on the Stellar ($XLM) network, as the Stellar Development Foundation (SDF) keeps looking at new ways to “further trust-minimized innovation” and enable “equitable access to the financial system.” In a blog post published by the SDF, it notes that adding smart contracts will “empower the ecosystem with more […]",https://www.cryptoglobe.com/latest/2022/01/xlm-smart-contracts-are-coming-to-stellar-network/,https://images.cryptocompare.com/news/cryptoglobe/b1s3MsG8S4w.jpeg,Altcoins|Stellar,ETH|Altcoin
88,2022-01-26,27429515,1643237066,Real Bedford Football Club To Accept Bitcoin Through OpenNode,The integration is the latest addition to the club’s suite of tools to embrace a Bitcoin standard.,https://bitcoinmagazine.com/business/real-bedford-fc-to-accept-bitcoin-payments,https://images.cryptocompare.com/news/default/bitcoinmagazine.png,Business|Opennode|News|Bitcoin|Real Bedford Football Club,BTC|Business
89,2022-01-26,27429466,1643236200,Why The Bitcoin Stock-to-Flow Model Is Not Useful,PlanB’s S2F/S2FX models are scientifically invalid and have fundamental issues that may lead investors astray.,https://bitcoinmagazine.com/markets/why-bitcoin-stock-to-flow-is-not-useful,https://images.cryptocompare.com/news/default/bitcoinmagazine.png,Ideas|Opinion|stock to flow|Markets|Marty's Bent|Technical analysis,BTC|Market|Business
90,2022-01-25,27428574,1643151534,"Ripple announces stock buyback, nabs $15 billion valuation","Ripple has nabbed a $15 billion valuation. The post Ripple announces stock buyback, nabs $15 billion valuation appeared first on The Block.",https://www.theblockcrypto.com/linked/131577/ripple-announces-stock-buyback-nabs-15-billion-valuation?utm_source=cryptocompare&utm_medium=rss,https://images.cryptocompare.com/news/default/theblock.png,Companies|$XRP|Ripple|stock buyback,XRP|Business
91,2022-01-25,27428576,1643151532,Market Recap: Crypto Holds Steady as Stocks Keep Tumbling,Crypto remained steady today despite stocks sinking further as investors prepare for Fed Chair Jerome Powell's press conference tomorrowThe post Market Recap: Crypto Holds Steady as Stocks Keep Tumbling appeared first on Blockworks.,https://blockworks.co/market-recap-crypto-holds-steady-as-stocks-keep-tumbling/,https://images.cryptocompare.com/news/default/blockworks.png,Macro|Markets|Bitcoin|BTC|BTC.D|congress|CPI|cryptocurrency|ETH|ETH/BTC|Ethereum|Fed|Federal Reserve|Inflation|Interest Rates|Jobs,Market|BTC|ETH|Business
92,2022-01-24,27427602,1643064969,Crypto Industry Awaits Biden’s Reported Crypto Executive Order,President Biden is expected to make the executive branch’s stance on cryptocurrency more clearThe post Crypto Industry Awaits Biden’s Reported Crypto Executive Order appeared first on Blockworks.,https://blockworks.co/biden-admin-readying-crypto-exec-order/,https://images.cryptocompare.com/news/default/blockworks.png,Regulation|Biden|CFTC|federal government|SEC|stablecoin|Treasury,Regulation
93,2022-01-24,27427599,1643064611,Market Recap: Russia and Ukraine Tensions Add More Fear to the Market,Tension between Russia and Ukraine have added fear to the markets as investors prepare for Fed Chair Jerome Powell's comments later this weekThe post Market Recap: Russia and Ukraine Tensions Add More Fear to the Market appeared first on Blockworks.,https://blockworks.co/market-recap-russia-and-ukraine-tensions-add-more-fear-to-the-market/,https://images.cryptocompare.com/news/default/blockworks.png,Macro|Markets|Bitcoin|BTC|BTC.D|congress|CPI|cryptocurrency|ETH|ETH/BTC|Ethereum|Fed|Federal Reserve|Inflation|Interest Rates|Jobs,Market|BTC|ETH|Business
94,2022-01-23,27427075,1642977059,"Bitmain Reveals Hydro Bitcoin Miner With 198 Terahash, Produces Almost Double the Power of Today’s Top Machines","One of the largest bitcoin mining rig manufacturers in the world, Bitmain announced the launch of a new bitcoin miner that boasts speeds of up to 198 terahash per second (TH/s). The new model is called the Antminer S19 Pro+ Hyd. and it leverages liquid cooling technology in order to improve overall efficiency. Bitmain&#x2019;s Latest [&#8230;]",https://news.bitcoin.com/bitmain-reveals-hydro-bitcoin-miner-with-198-terahash-produces-almost-double-the-power-of-todays-top-machines/,https://images.cryptocompare.com/news/default/bitcoincom.png,Mining|198 Terahash|198 TH/s|210 units|Antminer|Antminer S19 Pro+ Hyd.|Antspace HK3|Bitcoin|Bitcoin (BTC)|Bitcoin Miners|Bitmain|Bitnile|BTC|BTC miners|BTC Mining Rigs|Greenidge|hydro|Hydro Powered|liquid cooling|Mining Device|Mining Machine|Mining Rig|mining rig manufacturer|Specifications|XP machines,BTC|Mining|Technology
95,2022-01-23,27427076,1642977015,Here’s where Uniswap might be heading after a volatile last quarter,"Uniswap, the decentralized liquidity provision protocol on Ethereum, saw a volatile quarter in the crypto-market last year. With 2022 seeing the market lean towards the bears, what can we expect from Uniswap going forward? A recent report by Messari noted some key parameters for Uniswap in Q4 2021, parameters that marked the end of a [&#8230;]",https://ambcrypto.com/heres-where-uniswap-might-be-heading-after-a-volatile-last-quarter/,https://images.cryptocompare.com/news/default/ambcrypto.png,DeFi|Global News|News|News 1|Social|Trading View|uniswap,ETH|Market|Blockchain
96,2022-01-22,27426921,1642890642,"MANA breaks down below crucial demand zone, can it see further free fall","On the higher timeframes, such as 12-hour and daily, Decentraland was in dangerous territory for the bulls. There simply was not enough price action on the surge from $1 to $2.2 for any significant support levels to be established. In a previous article, it was noted that the $2.4 level of support could be tested [&#8230;]",https://ambcrypto.com/mana-breaks-down-below-crucial-demand-zone-can-it-see-further-free-fall/,https://images.cryptocompare.com/news/default/ambcrypto.png,Altcoins|Analysis|HideCryptopanic|News|News 1|Social|Trading View|Decentraland|MANA Price Prediction,Market|Trading|Altcoin
97,2022-01-22,27426920,1642890626,"While BTC’s Price Slid Lower, a Miner Spent an 11-Year-Old Block Reward from 2010 Worth $1.8M","Following the large string of block rewards from 2010 spent in November 2021, no block rewards from that year were discovered in December and throughout the next month up until January 21. On Friday, an 11-year-old block reward originally mined on November 22, 2010, was transferred for the first time since being idle for more [&#8230;]",https://news.bitcoin.com/while-btcs-price-slid-lower-miner-spent-11-year-old-block-reward-from-2010/,https://images.cryptocompare.com/news/default/bitcoincom.png,Featured|$1.8 Million|11 Year Old Bitcoins|2010 BTC|2010 coins|2010 spend|50 BTC|Bitcoin (BTC)|Bitquery.io|Block reward|block subsidy|Blocks|BTC transfer|Btcparser.com|Coinbase|coinbase reward|data|Decade-Old|Mined|Old Miner|Onchain data|theholyroger.com|visual perspective,Mining|Trading|Sponsored
98,2022-01-21,27426699,1642805582,Marathon Digital: Buy The Dip Before Bitcoin Fear Turns Into Greed,"Marathon Digital Holdings remains one of the top Bitcoin mining companies despite a massive drop in Bitcoin prices.Bitcoin is a historically volatile asset that incurs massive price swings. You will get the best prices on Bitcoin related stocks when Bitcoin fear is at its peak.The company remains on track to deploy 199,000 Bitcoin mining machines by early 2023, making it one of the largest Bitcoin mining companies in the world.",https://seekingalpha.com/article/4480893-marathon-digital-buy-dip-before-bitcoin-fear-turns-into-greed?utm_source=cryptocompare.com&utm_medium=referral,https://images.cryptocompare.com/news/default/seekingalpha.png,,BTC|Mining|Market|Trading
99,2022-01-21,27426698,1642805390,BlackRock Looks to Enter Crypto ETF Arena With Blockchain Fund,World’s largest asset manager manages about $2.4 trillion in ETF assetsThe post BlackRock Looks to Enter Crypto ETF Arena With Blockchain Fund appeared first on Blockworks.,https://blockworks.co/blackrock-files-for-crypto-etf/,https://images.cryptocompare.com/news/default/blockworks.png,Asset Management|BlackRock|blockchain|CFTC|crypto equities|crypto etf|crypto stocks|ETF,Blockchain
100,2022-01-20,27426135,1642719021,"Fed Opens Debate on CBDC, Takes No Policy Stance","The Fed was careful not to take a side in its Central Bank Digital Currency white paper Thursday, which the industry has been waiting for since MayThe post Fed Opens Debate on CBDC, Takes No Policy Stance appeared first on Blockworks.",https://blockworks.co/fed-opens-debate-on-cbdc-takes-no-policy-stance/,https://images.cryptocompare.com/news/default/blockworks.png,Regulation|CBDC|Powell|regulation,Regulation|Fiat
101,2022-01-20,27426136,1642718990,Industry Execs Make Case For Crypto Mining Before Congress,Industry experts insist that a switch to proof-of-stake is not the instant solution many hope it would be The post Industry Execs Make Case For Crypto Mining Before Congress appeared first on Blockworks.,https://blockworks.co/crypto-miners-go-to-congress/,https://images.cryptocompare.com/news/default/blockworks.png,Regulation|congress|crypto mining|lawmakers|Mining|Politics|regulation,Mining|Regulation
102,2022-01-19,27425464,1642632938,Secret Network Offers $400M to Build Privacy Ecosystem,,https://cryptobriefing.com/secret-network-offers-400m-to-build-privacy-ecosystem/?utm_source=main_feed&utm_medium=rss,https://images.cryptocompare.com/news/default/cryptobriefing.png,Business|News|Privacy|Secret Network,Business
103,2022-01-19,27425463,1642632600,9 Million Ether ($ETH) Worth $28 Billion Has Been Deposited Into Ethereum 2.0 Contract,"Over 9 million ETH has been deposited not the Ethereum 2.0 contract ahead of the activation of the most ambitious upgrade of the second-largest cryptocurrency by market cap. The upgrade is expected to improve its economic model, resource usage, and governance. According to data from the Ethereum blockchain, the total amount of ether deposited into […]",https://www.cryptoglobe.com/latest/2022/01/9-million-ether-eth-worth-28-billion-has-been-deposited-into-ethereum-2-0-contract/,https://images.cryptocompare.com/news/cryptoglobe/cMFC69xh6i1.jpeg,Altcoins|Ethereum,ETH|Market|Blockchain|Altcoin
104,2022-01-18,27424799,1642546200,"Most JPMorgan Clients See Bitcoin ($BTC) Surpass $60,000 This Year","Most of JPMorgan’s clients have revealed they see the price of Bitcoin surpass the $60,000 before the end of this year, with 41% saying the cryptocurrency will trade at that level by the end of the year, 9% seeing it above $80,000 and 5% calling for $100,000. According to a note published last week, reported […]",https://www.cryptoglobe.com/latest/2022/01/most-jpmorgan-clients-see-bitcoin-btc-surpass-60000-this-year/,https://images.cryptocompare.com/news/cryptoglobe/d2421xzk2w0.jpeg,Bitcoin,BTC|Trading
105,2022-01-18,27424797,1642545989,SoFi scores conditional approval for bank charter from US regulator,Personal finance company SoFi has won conditional approval in its bid to create a nationally chartered bank.The post SoFi scores conditional approval for bank charter from US regulator appeared first on The Block.,https://www.theblockcrypto.com/linked/130722/sofi-scores-conditional-approval-for-bank-charter-from-us-regulator?utm_source=cryptocompare&utm_medium=rss,https://images.cryptocompare.com/news/default/theblock.png,banking charter|fintech|Impact|OCC|SoFi,Fiat
106,2022-01-17,27424035,1642459800,Cardano ($ADA) Sees Transaction Volume Briefly Surpass That of Ethereum ($ETH) Ahead of DEX Launch,"The transaction volume seen on the Cardano ($ADA) network has briefly surpassed that of the Ethereum ($ETH) blockchain ahead of the launch of a highly-anticipated decentralized exchange on Cardano called SundaeSwap. According to data from Messari, Cardano’s daily transaction volume was at one point above the $7 billion mark, surpassing the daily transactions volume seen […]",https://www.cryptoglobe.com/latest/2022/01/cardano-ada-sees-transaction-volume-briefly-surpass-that-of-ethereum-eth-ahead-of-dex-launch/,https://images.cryptocompare.com/news/cryptoglobe/9qik4G1imAF.jpeg,Altcoins|Cardano,ADA|ETH|Exchange|Blockchain|Altcoin
107,2022-01-17,27424032,1642458633,The A to Z of what’s standing in the way of a Bitcoin Spot ETF in the USA,"A Bitcoin Spot ETF in the USA has been on many wishlists for a while now, but Christmas 2021 did not deliver, leaving potential investors disappointed. What Bitcoin Did podcast host Peter McCormack and Messari founder Ryan Selkis recently discussed the obstacles that they believe are standing in the way of the USA&#8217;s first approved [&#8230;]",https://ambcrypto.com/the-a-to-z-of-whats-standing-in-the-way-of-a-bitcoin-spot-etf-in-the-usa/,https://images.cryptocompare.com/news/default/ambcrypto.png,Bitcoin|BTC Trading View|News|News 1|Social|Trading View|ETF|featured|SEC|what bitcoin did,BTC|Regulation|Business|Sponsored
108,2022-01-16,27423516,1642373376,"This Week on Crypto Twitter: NBA Stars Buy Bitcoin, Vitalik Welcomes Trolls, FWB DAO Ejects a Co-Founder","Eva Longoria sent World of Women NFTs flying after she bought in; Vitalik Buterin polled his followers about altcoins, with surprising results.",https://decrypt.co/90503/andre-iguodala-klay-thompson-bitcoin-vitalik-welcomes-trolls-fwb-dao-suspends-cooper-turley,https://images.cryptocompare.com/news/default/decrypt.png,Business,ETH|BTC|Altcoin|Business
109,2022-01-16,27423514,1642372257,Jack Dorsey’s Payments Company Is ‘Officially Building an Open Bitcoin Mining System’,"In mid-October 2021, Twitter founder Jack Dorsey revealed the payments firm Block Inc. (formally Square) was considering joining the bitcoin mining industry. Three months later, Dorsey tweeted that his firm was &#x201C;officially building an open bitcoin mining system.&#x201D; The Block&#x2019;s Hardware General Manager: &#x2018;We See Bitcoin Mining as a Long-Term Need for a Future That [&#8230;]",https://news.bitcoin.com/jack-dorseys-payments-company-is-officially-building-an-open-bitcoin-mining-system/,https://images.cryptocompare.com/news/default/bitcoincom.png,Mining|Bitcoin (BTC)|Bitcoin mining|Bitcoin mining solutions|bitcoin mining system|Bitcoin software|bitcoin tipping feature|Bitmain|Block Inc.|BTC Mining|BTC Mining Rigs|Canaan|custom silicon|Dorsey|Hardware Tom Templeton|Ipollo|Jack Dorsey|Microbt|Silicon|Silicon development|Square|Square founder|The Block|tipping|Tom Templeton,Mining|BTC
110,2022-01-15,27423252,1642286160,Litecoin To Pave The Way For Alt-Season This Quarter? LTC Price Run To $300 Imminent?,"The post Litecoin To Pave The Way For Alt-Season This Quarter? LTC Price Run To $300 Imminent? appeared first on Coinpedia - Fintech &amp; Cryptocurreny News Media| Crypto GuideThe crypto market has been seeking for a major impetus that could help the space hop onto the bulls. As the business has been dwindling in the midst of corrections. In the interim, veterans from the industry have been speculating the trends to be rhyming from 2017. Successively, Litecoin is now the talk of the &#8230;",https://coinpedia.org/altcoin/litecoin-to-pave-the-way-for-alt-season-this-quarter-ltc-price-run-to-300-imminent/,https://images.cryptocompare.com/news/default/coinpedia.png,Altcoins|Crypto news|cryptocurrency|Litecoin|Price Analysis,LTC|Trading|Market|Altcoin|Business
111,2022-01-15,27423251,1642285858,"Chainlink investors witness first profits in two months, but how long will it last","As the overall market recovery is slowly creeping in, altcoins like Chainlink too are looking at some sort of profits. But as enticing profits draw in new investors, certain other factors also hint towards a future where they might not gain returns as high as they might be expecting. Chainlink on thin ice? For any [&#8230;]",https://ambcrypto.com/chainlink-investors-witness-first-profits-in-two-months-but-how-long-will-it-last/,https://images.cryptocompare.com/news/default/ambcrypto.png,Altcoins|Analysis|Global News|News|News 1|Social|Trading View|chainlink|chainlink integration|Chainlink price rally|LINK,Market|Altcoin|Business
112,2022-01-14,27422840,1642200265,Bitfinex to End Services for Ontario Customers by March,,https://cryptobriefing.com/bitfinex-to-end-services-for-ontario-customers-by-march/?utm_source=main_feed&utm_medium=rss,https://images.cryptocompare.com/news/default/cryptobriefing.png,Business|News|Bitfinex|Crypto Exchanges|Trading,Exchange|Trading|Business
113,2022-01-14,27422836,1642199455,British Lawmakers Say a CBDC Is Likely to Hurt Financial Stability — Digital Pound Benefits Overstated,"According to British lawmakers, a central bank digital currency (CBDC) is likely to raise the cost of borrowing while hurting financial stability. They insist the touted potential advantages of a digital pound are being overstated. Erosion of Privacy British lawmakers have said the use of a central bank digital currency when making regular payments could [&#8230;]",https://news.bitcoin.com/british-lawmakers-say-a-cbdc-is-likely-to-hurt-financial-stability-digital-pound-benefits-overstated/,https://images.cryptocompare.com/news/default/bitcoincom.png,Fintech|Bank of England|British parliament|CBDC|Central Bank|cost of borrowing|digital pound|financial stability|Michael Forsyth|UK Treasury,Fiat|ICO
114,2022-01-13,27421981,1642114362,Market Recap: Bitcoin Slides as Interest Rate Increase Looms,The increase in jobless claims and the Fed's looming rate hikes have put pressure on both traditional and crypto marketsThe post Market Recap: Bitcoin Slides as Interest Rate Increase Looms appeared first on Blockworks.,https://blockworks.co/market-recap-bitcoin-slides-as-interest-rate-increase-looms/,https://images.cryptocompare.com/news/default/blockworks.png,Macro|Markets|Bitcoin|BTC|BTC.D|CPI|cryptocurrency|ETH|ETH/BTC|Ethereum|Fed|Federal Reserve|Inflation|Interest Rates|Jobs,BTC|Market|ETH
115,2022-01-13,27421935,1642114062,Jack Dorsey’s Block Is Building A Bitcoin Mining System,The financial services company has started sketching some plans for solving the industry’s most pressing paint points.,https://bitcoinmagazine.com/business/jack-dorsey-block-is-building-a-bitcoin-mining-system,https://images.cryptocompare.com/news/default/bitcoinmagazine.png,Business|Jack Dorsey|Block|Bitcoin|Bitcoin mining|News,BTC|Mining|Business
116,2022-01-12,27420997,1642028117,"Coinbase Acquiring Derivatives Exchange, Bitcoin Futures Trading to Follow","Coinbase is finalizing the acquisition of CFTC-regulated derivatives exchange FairX, paving the way for crypto futures and options trading on the platform.",https://decrypt.co/90341/coinbase-acquiring-derivatives-exchange-bitcoin-futures-trading,https://images.cryptocompare.com/news/default/decrypt.png,Coins|BTC,BTC|Exchange|Trading
